{
  "schema": "hpi/wire/task-slice/v2",
  "task_id": "TS001-VAL",
  "project_id": "HPI-TS001-PILOT",
  "title": "TS-001 独立验证切片",
  "objective": "独立运行 4 组 31 条用例清单，核验不变量并出具 CONFORMANT 凭据。",
  "pain_refs": [
    {
      "id": "P-HPI-002",
      "revision": "1",
      "sha256": "61e4c6ea9cabdd335a86a64845fa4bfa8c1b6be8b4bdbec94e667de18db9d030",
      "pointer": "human-project-interaction-skills-prd.md"
    }
  ],
  "requirement_refs": [],
  "design_refs": [],
  "non_goals": [
    "不替代人类最终业务验收。",
    "不修改代码或配置。"
  ],
  "permission_scope": {
    "allowed_paths": [
      ".pi/artifacts/ts001-validation/**",
      "tests/fixtures/ts001/**"
    ],
    "forbidden_paths": [
      "canonical/**",
      "schemas/**",
      "src/**"
    ],
    "data_classes": [
      "INTERNAL"
    ],
    "network": {
      "mode": "DENY",
      "allowed_hosts": []
    }
  },
  "input_refs": [
    {
      "id": "TS001-IMPL",
      "revision": "beedcb19fa802a5ebf5230b762ee3a32b734424e4e7ebebf22eb1d2529385b28",
      "sha256": "beedcb19fa802a5ebf5230b762ee3a32b734424e4e7ebebf22eb1d2529385b28",
      "pointer": "tests/fixtures/ts001/task-slices/ts001-impl.v2.json"
    }
  ],
  "shared_contract_ref": {
    "id": "TS1-TEST-001",
    "revision": "1",
    "sha256": "e0aeffc678717ba7416b5ff775683ec00919ecc9bdf6054327f6020dedfb9804",
    "pointer": "09_TS001_测试与回滚验收.md"
  },
  "acceptance_ref": {
    "id": "TS1-TEST-001",
    "revision": "1",
    "sha256": "e0aeffc678717ba7416b5ff775683ec00919ecc9bdf6054327f6020dedfb9804",
    "pointer": "09_TS001_测试与回滚验收.md"
  },
  "failure_semantics": "任一用例失败即 NON-CONFORMANT；不自动跳过。",
  "rollback": "测试记录隔离保留，不覆盖历史。",
  "assigned_roles": {
    "implementation": {
      "agent_id": "agent-impl",
      "role": "IMPLEMENTATION",
      "harness_revision": "harness/pilot-v1"
    },
    "validation": {
      "agent_id": "agent-ts001-validator",
      "role": "VALIDATION",
      "harness_revision": "harness/pilot-v1"
    }
  },
  "machine_status": "NOT-RUN",
  "human_status": "NOT_NEEDED",
  "status_source": {
    "id": "TS1-TEST-001",
    "revision": "1",
    "sha256": "e0aeffc678717ba7416b5ff775683ec00919ecc9bdf6054327f6020dedfb9804",
    "pointer": "09_TS001_测试与回滚验收.md"
  },
  "changed_fields": [],
  "provenance_refs": [
    {
      "id": "TS1-TEST-001",
      "revision": "1",
      "sha256": "e0aeffc678717ba7416b5ff775683ec00919ecc9bdf6054327f6020dedfb9804",
      "pointer": "09_TS001_测试与回滚验收.md"
    }
  ],
  "created_at": "2026-08-29T10:00:00.000Z",
  "task_revision": "9835d54db12a896a4a357a73b722f680a25d4feda60e2d0b65bde1f4f6960ad8"
}
